{"schema_version":1,"blueprint_id":"duration-60s-compact-arc","blueprint_version":1,"definition_digest":"aaaaaaaaaaaaaaaaaaaaaaaaaaaaaaaaaaaaaaaaaaaaaaaaaaaaaaaaaaaaaaaa","status":"published","duration_class":"60s","objective":"One compact evidence-bound arc","target_duration":{"schema_version":1,"value":60,"timescale":1},"acceptable_variance":{"schema_version":1,"value":2,"timescale":1},"beat_count":{"minimum":4,"maximum":7},"information_density":"high","redundancy_policy":"none","beat_roles":[{"role_id":"hook","minimum_duration":{"schema_version":1,"value":5,"timescale":1},"maximum_duration":{"schema_version":1,"value":12,"timescale":1},"minimum_evidence_count":1},{"role_id":"development","minimum_duration":{"schema_version":1,"value":30,"timescale":1},"maximum_duration":{"schema_version":1,"value":48,"timescale":1},"minimum_evidence_count":2},{"role_id":"ending","minimum_duration":{"schema_version":1,"value":8,"timescale":1},"maximum_duration":{"schema_version":1,"value":15,"timescale":1},"minimum_evidence_count":1}],"emotional_curve":[{"phase":"hook","position":0,"intensity":0.8},{"phase":"turn","position":0.6,"intensity":1},{"phase":"resolution","position":1,"intensity":0.6}],"ending_contract":{"objective":"Resolve the central promise","reserve":{"schema_version":1,"value":8,"timescale":1},"minimum_evidence_count":1},"created_at":"2026-08-24T00:00:00Z","provenance":{"producer":"curated-author","source_id":"duration-blueprints","source_version":"1","policy_version":"duration-policy-v1"},"governance":{"reviewer_id":"ave-review","reviewed_at":"2026-08-24T00:00:00Z","trust_status":"trusted"}}
